{
  "schemaVersion": "1.0",
  "manifestId": "REPLACE",
  "mode": "LOCAL_LIVE_READ",
  "sourceCommit": "REPLACE_WITH_40_HEX_SOURCE_COMMIT",
  "collectedAt": "2026-01-01T00:00:00Z",
  "sanitizedAt": "2026-01-01T00:00:00Z",
  "sourceAliases": [],
  "capabilities": [],
  "artifacts": [],
  "limitations": [],
  "reviewedBy": "REPLACE"
}
